"date","from","to","action_team","notes","edge_label"
"2015-07-14","cash","2018 second round pick (protected top 55) (#57-Kevin Hervey)","Celtics","trade with Thunder","On 2015-07-14, Celtics makes trade with Thunder for cash in exhchange of 2018 second round pick (protected top 55) (#57-Kevin Hervey)"
"2015-07-20","Nick Johnson","Ty Lawson","Nuggets","trade with Rockets","On 2015-07-20, Nuggets makes trade with Rockets for Nick Johnson in exhchange of Ty Lawson"
"2015-07-20","Nick Johnson","2017 second round pick (#43-Isaiah Hartenstein)","Nuggets","trade with Rockets","On 2015-07-20, Nuggets makes trade with Rockets for Nick Johnson in exhchange of 2017 second round pick (#43-Isaiah Hartenstein)"
"2015-07-20","Kostas Papanikolaou","Ty Lawson","Nuggets","trade with Rockets","On 2015-07-20, Nuggets makes trade with Rockets for Kostas Papanikolaou in exhchange of Ty Lawson"
"2015-07-20","Kostas Papanikolaou","2017 second round pick (#43-Isaiah Hartenstein)","Nuggets","trade with Rockets","On 2015-07-20, Nuggets makes trade with Rockets for Kostas Papanikolaou in exhchange of 2017 second round pick (#43-Isaiah Hartenstein)"
"2015-07-20","Pablo Prigioni","Ty Lawson","Nuggets","trade with Rockets","On 2015-07-20, Nuggets makes trade with Rockets for Pablo Prigioni in exhchange of Ty Lawson"
"2015-07-20","Pablo Prigioni","2017 second round pick (#43-Isaiah Hartenstein)","Nuggets","trade with Rockets","On 2015-07-20, Nuggets makes trade with Rockets for Pablo Prigioni in exhchange of 2017 second round pick (#43-Isaiah Hartenstein)"
"2015-07-20","Joey Dorsey","Ty Lawson","Nuggets","trade with Rockets","On 2015-07-20, Nuggets makes trade with Rockets for Joey Dorsey in exhchange of Ty Lawson"
"2015-07-20","Joey Dorsey","2017 second round pick (#43-Isaiah Hartenstein)","Nuggets","trade with Rockets","On 2015-07-20, Nuggets makes trade with Rockets for Joey Dorsey in exhchange of 2017 second round pick (#43-Isaiah Hartenstein)"
"2015-07-20","2016 first round pick (protected top 14 in 2016, else 2017 second round pick, cash) (#15-Juancho Hernangomez / Juan Hernangomez)","Ty Lawson","Nuggets","trade with Rockets","On 2015-07-20, Nuggets makes trade with Rockets for 2016 first round pick (protected top 14 in 2016, else 2017 second round pick, cash) (#15-Juancho Hernangomez / Juan Hernangomez) in exhchange of Ty Lawson"
"2015-07-20","2016 first round pick (protected top 14 in 2016, else 2017 second round pick, cash) (#15-Juancho Hernangomez / Juan Hernangomez)","2017 second round pick (#43-Isaiah Hartenstein)","Nuggets","trade with Rockets","On 2015-07-20, Nuggets makes trade with Rockets for 2016 first round pick (protected top 14 in 2016, else 2017 second round pick, cash) (#15-Juancho Hernangomez / Juan Hernangomez) in exhchange of 2017 second round pick (#43-Isaiah Hartenstein)"
"2015-07-20","cash considerations","Ty Lawson","Nuggets","trade with Rockets","On 2015-07-20, Nuggets makes trade with Rockets for cash considerations in exhchange of Ty Lawson"
"2015-07-20","cash considerations","2017 second round pick (#43-Isaiah Hartenstein)","Nuggets","trade with Rockets","On 2015-07-20, Nuggets makes trade with Rockets for cash considerations in exhchange of 2017 second round pick (#43-Isaiah Hartenstein)"
"2015-07-27","Brendan Haywood","2 trade exceptions (?) (?) / cash considerations (P S)","Blazers","trade with Cavaliers","On 2015-07-27, Blazers makes trade with Cavaliers for Brendan Haywood in exhchange of 2 trade exceptions (?) (?) / cash considerations (P S)"
"2015-07-27","Mike Miller","2 trade exceptions (?) (?) / cash considerations (P S)","Blazers","trade with Cavaliers","On 2015-07-27, Blazers makes trade with Cavaliers for Mike Miller in exhchange of 2 trade exceptions (?) (?) / cash considerations (P S)"
"2015-07-27","David Lee","Gerald Wallace","Celtics","trade with Warriors","On 2015-07-27, Celtics makes trade with Warriors for David Lee in exhchange of Gerald Wallace"
"2015-07-27","David Lee","Chris Babb","Celtics","trade with Warriors","On 2015-07-27, Celtics makes trade with Warriors for David Lee in exhchange of Chris Babb"
"2015-07-27","2016 second round pick (protected top 55 in 2016, else extinguished) (not exercised)","Shabazz Napier","Heat","trade with Magic","On 2015-07-27, Heat makes trade with Magic for 2016 second round pick (protected top 55 in 2016, else extinguished) (not exercised) in exhchange of Shabazz Napier"
"2015-07-27","2016 second round pick (protected top 55 in 2016, else extinguished) (not exercised)","cash considerations","Heat","trade with Magic","On 2015-07-27, Heat makes trade with Magic for 2016 second round pick (protected top 55 in 2016, else extinguished) (not exercised) in exhchange of cash considerations"
"2015-07-31","Gerald Wallace","Jason Thompson","76ers","trade with Warriors","On 2015-07-31, 76ers makes trade with Warriors for Gerald Wallace in exhchange of Jason Thompson"
"2015-07-31","Gerald Wallace","76ers option to swap 2016 first round picks (less favorable of Heat (protected top 10), Thunder (protected top 15) picks) with Warriors (not exercised)","76ers","trade with Warriors","On 2015-07-31, 76ers makes trade with Warriors for Gerald Wallace in exhchange of 76ers option to swap 2016 first round picks (less favorable of Heat (protected top 10), Thunder (protected top 15) picks) with Warriors (not exercised)"
"2015-07-31","76ers option to swap 2016 first round picks with Warriors (not exercised)","Jason Thompson","76ers","trade with Warriors","On 2015-07-31, 76ers makes trade with Warriors for 76ers option to swap 2016 first round picks with Warriors (not exercised) in exhchange of Jason Thompson"
"2015-07-31","76ers option to swap 2016 first round picks with Warriors (not exercised)","76ers option to swap 2016 first round picks (less favorable of Heat (protected top 10), Thunder (protected top 15) picks) with Warriors (not exercised)","76ers","trade with Warriors","On 2015-07-31, 76ers makes trade with Warriors for 76ers option to swap 2016 first round picks with Warriors (not exercised) in exhchange of 76ers option to swap 2016 first round picks (less favorable of Heat (protected top 10), Thunder (protected top 15) picks) with Warriors (not exercised)"
"2015-07-31","cash considerations","Jason Thompson","76ers","trade with Warriors","On 2015-07-31, 76ers makes trade with Warriors for cash considerations in exhchange of Jason Thompson"
"2015-07-31","cash considerations","76ers option to swap 2016 first round picks (less favorable of Heat (protected top 10), Thunder (protected top 15) picks) with Warriors (not exercised)","76ers","trade with Warriors","On 2015-07-31, 76ers makes trade with Warriors for cash considerations in exhchange of 76ers option to swap 2016 first round picks (less favorable of Heat (protected top 10), Thunder (protected top 15) picks) with Warriors (not exercised)"
"2015-11-10","Mario Chalmers","Beno Udrih","Grizzlies","trade with Heat","On 2015-11-10, Grizzlies makes trade with Heat for Mario Chalmers in exhchange of Beno Udrih"
"2015-11-10","Mario Chalmers","Jarnell Stokes","Grizzlies","trade with Heat","On 2015-11-10, Grizzlies makes trade with Heat for Mario Chalmers in exhchange of Jarnell Stokes"
"2015-11-10","James Ennis","Beno Udrih","Grizzlies","trade with Heat","On 2015-11-10, Grizzlies makes trade with Heat for James Ennis in exhchange of Beno Udrih"
"2015-11-10","James Ennis","Jarnell Stokes","Grizzlies","trade with Heat","On 2015-11-10, Grizzlies makes trade with Heat for James Ennis in exhchange of Jarnell Stokes"
"2015-12-24","Ishmael Smith / Ish Smith","2016 second round pick (#39-David Michineau)","76ers","trade with Pelicans","On 2015-12-24, 76ers makes trade with Pelicans for Ishmael Smith / Ish Smith in exhchange of 2016 second round pick (#39-David Michineau)"
"2015-12-24","Ishmael Smith / Ish Smith","2017 second round pick (#34-Frank Mason)","76ers","trade with Pelicans","On 2015-12-24, 76ers makes trade with Pelicans for Ishmael Smith / Ish Smith in exhchange of 2017 second round pick (#34-Frank Mason)"
"2016-01-22","rights to Maarty Leunen","Josh Smith","Clippers","trade with Rockets","On 2016-01-22, Clippers makes trade with Rockets for rights to Maarty Leunen in exhchange of Josh Smith"
"2016-01-22","rights to Maarty Leunen","rights to Sergei Lishouk / Sergei Lishchuk","Clippers","trade with Rockets","On 2016-01-22, Clippers makes trade with Rockets for rights to Maarty Leunen in exhchange of rights to Sergei Lishouk / Sergei Lishchuk"
"2016-01-22","rights to Maarty Leunen","cash","Clippers","trade with Rockets","On 2016-01-22, Clippers makes trade with Rockets for rights to Maarty Leunen in exhchange of cash"
"2016-02-11","Kris Humphries","Markieff Morris","Suns","trade with Wizards","On 2016-02-11, Suns makes trade with Wizards for Kris Humphries in exhchange of Markieff Morris"
"2016-02-11","DeJuan Blair","Markieff Morris","Suns","trade with Wizards","On 2016-02-11, Suns makes trade with Wizards for DeJuan Blair in exhchange of Markieff Morris"
"2016-02-11","2016 first round pick (protected top 9 in 2016-21) (#13-Georgios Papagiannis / Giorgios Papagiannis / George Papagiannis)","Markieff Morris","Suns","trade with Wizards","On 2016-02-11, Suns makes trade with Wizards for 2016 first round pick (protected top 9 in 2016-21) (#13-Georgios Papagiannis / Giorgios Papagiannis / George Papagiannis) in exhchange of Markieff Morris"
"2016-02-16","P.J. Hairston","Courtney Lee","Grizzlies","3-team trade with Heat, Hornets","On 2016-02-16, Grizzlies makes 3-team trade with Heat, Hornets for P.J. Hairston in exhchange of Courtney Lee"
"2016-02-16","P.J. Hairston","cash","Grizzlies","3-team trade with Heat, Hornets","On 2016-02-16, Grizzlies makes 3-team trade with Heat, Hornets for P.J. Hairston in exhchange of cash"
"2016-02-16","Chris Andersen","Courtney Lee","Grizzlies","3-team trade with Heat, Hornets","On 2016-02-16, Grizzlies makes 3-team trade with Heat, Hornets for Chris Andersen in exhchange of Courtney Lee"
"2016-02-16","Chris Andersen","cash","Grizzlies","3-team trade with Heat, Hornets","On 2016-02-16, Grizzlies makes 3-team trade with Heat, Hornets for Chris Andersen in exhchange of cash"
"2016-02-16","2018 second round pick (from Hornets) (#41-Jarred Vanderbilt)","Courtney Lee","Grizzlies","3-team trade with Heat, Hornets","On 2016-02-16, Grizzlies makes 3-team trade with Heat, Hornets for 2018 second round pick (from Hornets) (#41-Jarred Vanderbilt) in exhchange of Courtney Lee"
"2016-02-16","2018 second round pick (from Hornets) (#41-Jarred Vanderbilt)","cash","Grizzlies","3-team trade with Heat, Hornets","On 2016-02-16, Grizzlies makes 3-team trade with Heat, Hornets for 2018 second round pick (from Hornets) (#41-Jarred Vanderbilt) in exhchange of cash"
"2016-02-16","second round pick (from Heat) (protected #41-60 in 2017, unprotected in 2018) (2018 #46-De'Anthony Melton)","Courtney Lee","Grizzlies","3-team trade with Heat, Hornets","On 2016-02-16, Grizzlies makes 3-team trade with Heat, Hornets for second round pick (from Heat) (protected #41-60 in 2017, unprotected in 2018) (2018 #46-De'Anthony Melton) in exhchange of Courtney Lee"
"2016-02-16","second round pick (from Heat) (protected #41-60 in 2017, unprotected in 2018) (2018 #46-De'Anthony Melton)","cash","Grizzlies","3-team trade with Heat, Hornets","On 2016-02-16, Grizzlies makes 3-team trade with Heat, Hornets for second round pick (from Heat) (protected #41-60 in 2017, unprotected in 2018) (2018 #46-De'Anthony Melton) in exhchange of cash"
"2016-02-16","Brian Roberts","Chris Andersen","Heat","3-team trade with Grizzlies, Hornets","On 2016-02-16, Heat makes 3-team trade with Grizzlies, Hornets for Brian Roberts in exhchange of Chris Andersen"
"2016-02-16","Brian Roberts","second round pick (protected #41-60 in 2017, unprotected in 2018) (2018 #46-De'Anthony Melton)","Heat","3-team trade with Grizzlies, Hornets","On 2016-02-16, Heat makes 3-team trade with Grizzlies, Hornets for Brian Roberts in exhchange of second round pick (protected #41-60 in 2017, unprotected in 2018) (2018 #46-De'Anthony Melton)"
"2016-02-16","Courtney Lee","Brian Roberts","Hornets","3-team trade with Grizzlies, Heat","On 2016-02-16, Hornets makes 3-team trade with Grizzlies, Heat for Courtney Lee in exhchange of Brian Roberts"
"2016-02-16","Courtney Lee","2018 second round pick (#41-Jarred Vanderbilt)","Hornets","3-team trade with Grizzlies, Heat","On 2016-02-16, Hornets makes 3-team trade with Grizzlies, Heat for Courtney Lee in exhchange of 2018 second round pick (#41-Jarred Vanderbilt)"
"2016-02-16","cash","Brian Roberts","Hornets","3-team trade with Grizzlies, Heat","On 2016-02-16, Hornets makes 3-team trade with Grizzlies, Heat for cash in exhchange of Brian Roberts"
"2016-02-16","cash","2018 second round pick (#41-Jarred Vanderbilt)","Hornets","3-team trade with Grizzlies, Heat","On 2016-02-16, Hornets makes 3-team trade with Grizzlies, Heat for cash in exhchange of 2018 second round pick (#41-Jarred Vanderbilt)"
"2016-02-16","Brandon Jennings","Tobias Harris","Magic","trade with Pistons","On 2016-02-16, Magic makes trade with Pistons for Brandon Jennings in exhchange of Tobias Harris"
"2016-02-16","Ersan Ilyasova","Tobias Harris","Magic","trade with Pistons","On 2016-02-16, Magic makes trade with Pistons for Ersan Ilyasova in exhchange of Tobias Harris"
"2016-02-18","Channing Frye","Jared Cunningham","Cavaliers","trade with Magic","On 2016-02-18, Cavaliers makes trade with Magic for Channing Frye in exhchange of Jared Cunningham"
"2016-02-18","Justin Holiday","Kirk Hinrich","Bulls","3-team trade with Jazz, Hawks","On 2016-02-18, Bulls makes 3-team trade with Jazz, Hawks for Justin Holiday in exhchange of Kirk Hinrich"
"2016-02-18","2018 second round pick (from Jazz) (#47-Sviatoslav Mykhailiuk / Svi Mykhailiuk)","Kirk Hinrich","Bulls","3-team trade with Jazz, Hawks","On 2016-02-18, Bulls makes 3-team trade with Jazz, Hawks for 2018 second round pick (from Jazz) (#47-Sviatoslav Mykhailiuk / Svi Mykhailiuk) in exhchange of Kirk Hinrich"
"2016-02-18","Kirk Hinrich","Shelvin Mack","Hawks","3-team trade with Bulls, Jazz","On 2016-02-18, Hawks makes 3-team trade with Bulls, Jazz for Kirk Hinrich in exhchange of Shelvin Mack"
"2016-02-18","Shelvin Mack","2018 second round pick (#47-Sviatoslav Mykhailiuk / Svi Mykhailiuk)","Jazz","3-team trade with Bulls, Hawks","On 2016-02-18, Jazz makes 3-team trade with Bulls, Hawks for Shelvin Mack in exhchange of 2018 second round pick (#47-Sviatoslav Mykhailiuk / Svi Mykhailiuk)"
"2016-02-18","2018 second round pick (protected top 55, subsequent trade of this pick back to Pelicans effectively removed protection) (#51-Tony Carr)","Jarnell Stokes","Heat","trade with Pelicans","On 2016-02-18, Heat makes trade with Pelicans for 2018 second round pick (protected top 55, subsequent trade of this pick back to Pelicans effectively removed protection) (#51-Tony Carr) in exhchange of Jarnell Stokes"
"2016-02-18","2018 second round pick (protected top 55, subsequent trade of this pick back to Pelicans effectively removed protection) (#51-Tony Carr)","cash considerations","Heat","trade with Pelicans","On 2016-02-18, Heat makes trade with Pelicans for 2018 second round pick (protected top 55, subsequent trade of this pick back to Pelicans effectively removed protection) (#51-Tony Carr) in exhchange of cash considerations"
"2016-02-18","D.J. Augustine","Randy Foye","Nuggets","trade with Thunder","On 2016-02-18, Nuggets makes trade with Thunder for D.J. Augustine in exhchange of Randy Foye"
"2016-02-18","Steve Novak","Randy Foye","Nuggets","trade with Thunder","On 2016-02-18, Nuggets makes trade with Thunder for Steve Novak in exhchange of Randy Foye"
"2016-02-18","2016 second round pick (protected #56-60 in 2016, unprotected in 2017) (2016 #53-Petr Cornelie)","Randy Foye","Nuggets","trade with Thunder","On 2016-02-18, Nuggets makes trade with Thunder for 2016 second round pick (protected #56-60 in 2016, unprotected in 2017) (2016 #53-Petr Cornelie) in exhchange of Randy Foye"
"2016-02-18","2016 second round pick (#56-Daniel Hamilton)","Randy Foye","Nuggets","trade with Thunder","On 2016-02-18, Nuggets makes trade with Thunder for 2016 second round pick (#56-Daniel Hamilton) in exhchange of Randy Foye"
"2016-02-18","cash","Randy Foye","Nuggets","trade with Thunder","On 2016-02-18, Nuggets makes trade with Thunder for cash in exhchange of Randy Foye"
"2016-02-18","Jeff Green","Lance Stephenson","Clippers","trade with Grizzlies","On 2016-02-18, Clippers makes trade with Grizzlies for Jeff Green in exhchange of Lance Stephenson"
"2016-02-18","Brian Roberts","cash considerations","Blazers","trade with Heat","On 2016-02-18, Blazers makes trade with Heat for Brian Roberts in exhchange of cash considerations"
"2016-02-18","Donatas Motiejunas","Joel Anthony","Pistons","trade with Rockets (trade later voided)","On 2016-02-18, Pistons makes trade with Rockets (trade later voided) for Donatas Motiejunas in exhchange of Joel Anthony"
"2016-02-18","Donatas Motiejunas","2016 first round pick (protected top 8 in 2016, top 10 in 2017) (voided)","Pistons","trade with Rockets (trade later voided)","On 2016-02-18, Pistons makes trade with Rockets (trade later voided) for Donatas Motiejunas in exhchange of 2016 first round pick (protected top 8 in 2016, top 10 in 2017) (voided)"
"2016-02-18","Marcus Thornton (T.)","Joel Anthony","Pistons","trade with Rockets (trade later voided)","On 2016-02-18, Pistons makes trade with Rockets (trade later voided) for Marcus Thornton (T.) in exhchange of Joel Anthony"
"2016-02-18","Marcus Thornton (T.)","2016 first round pick (protected top 8 in 2016, top 10 in 2017) (voided)","Pistons","trade with Rockets (trade later voided)","On 2016-02-18, Pistons makes trade with Rockets (trade later voided) for Marcus Thornton (T.) in exhchange of 2016 first round pick (protected top 8 in 2016, top 10 in 2017) (voided)"
"2016-02-18","Joel Anthony","rights to Chukwudiebere Maduabum / Chu Chu Maduabum","76ers","trade with Rockets (trade later voided)","On 2016-02-18, 76ers makes trade with Rockets (trade later voided) for Joel Anthony in exhchange of rights to Chukwudiebere Maduabum / Chu Chu Maduabum"
"2016-02-18","2017 second round pick (not exercised)","rights to Chukwudiebere Maduabum / Chu Chu Maduabum","76ers","trade with Rockets (trade later voided)","On 2016-02-18, 76ers makes trade with Rockets (trade later voided) for 2017 second round pick (not exercised) in exhchange of rights to Chukwudiebere Maduabum / Chu Chu Maduabum"
"2016-06-17","Spencer Dinwiddie","Cameron Bairstow","Bulls","trade with Pistons","On 2016-06-17, Bulls makes trade with Pistons for Spencer Dinwiddie in exhchange of Cameron Bairstow"
"2016-06-22","Robin Lopez","Derrick Rose","Bulls","trade with Knicks","On 2016-06-22, Bulls makes trade with Knicks for Robin Lopez in exhchange of Derrick Rose"
"2016-06-22","Robin Lopez","Justin Holiday","Bulls","trade with Knicks","On 2016-06-22, Bulls makes trade with Knicks for Robin Lopez in exhchange of Justin Holiday"
"2016-06-22","Robin Lopez","2017 second round pick (#44-Damyean Dotson)","Bulls","trade with Knicks","On 2016-06-22, Bulls makes trade with Knicks for Robin Lopez in exhchange of 2017 second round pick (#44-Damyean Dotson)"
"2016-06-22","Jerian Grant","Derrick Rose","Bulls","trade with Knicks","On 2016-06-22, Bulls makes trade with Knicks for Jerian Grant in exhchange of Derrick Rose"
"2016-06-22","Jerian Grant","Justin Holiday","Bulls","trade with Knicks","On 2016-06-22, Bulls makes trade with Knicks for Jerian Grant in exhchange of Justin Holiday"
"2016-06-22","Jerian Grant","2017 second round pick (#44-Damyean Dotson)","Bulls","trade with Knicks","On 2016-06-22, Bulls makes trade with Knicks for Jerian Grant in exhchange of 2017 second round pick (#44-Damyean Dotson)"
"2016-06-22","Jose Calderon","Derrick Rose","Bulls","trade with Knicks","On 2016-06-22, Bulls makes trade with Knicks for Jose Calderon in exhchange of Derrick Rose"
"2016-06-22","Jose Calderon","Justin Holiday","Bulls","trade with Knicks","On 2016-06-22, Bulls makes trade with Knicks for Jose Calderon in exhchange of Justin Holiday"
"2016-06-22","Jose Calderon","2017 second round pick (#44-Damyean Dotson)","Bulls","trade with Knicks","On 2016-06-22, Bulls makes trade with Knicks for Jose Calderon in exhchange of 2017 second round pick (#44-Damyean Dotson)"
"2016-06-23","rights to Jake Layman","cash considerations","Blazers","trade with Magic","On 2016-06-23, Blazers makes trade with Magic for rights to Jake Layman in exhchange of cash considerations"
"2016-06-23","cash considerations","rights to Patrick McCaw","Bucks","trade with Warriors","On 2016-06-23, Bucks makes trade with Warriors for cash considerations in exhchange of rights to Patrick McCaw"
"2016-06-23","rights to David Michineau","rights to Cheick Diallo","Clippers","trade with Pelicans","On 2016-06-23, Clippers makes trade with Pelicans for rights to David Michineau in exhchange of rights to Cheick Diallo"
"2016-06-23","rights to Diamond Stone","rights to Cheick Diallo","Clippers","trade with Pelicans","On 2016-06-23, Clippers makes trade with Pelicans for rights to Diamond Stone in exhchange of rights to Cheick Diallo"
"2016-06-23","rights to Marcus Paige","rights to Isaiah Whitehead","Jazz","trade with Nets","On 2016-06-23, Jazz makes trade with Nets for rights to Marcus Paige in exhchange of rights to Isaiah Whitehead"
"2016-06-23","cash considerations","rights to Isaiah Whitehead","Jazz","trade with Nets","On 2016-06-23, Jazz makes trade with Nets for cash considerations in exhchange of rights to Isaiah Whitehead"
"2016-06-23","rights to Bogdan Bogdanovic","rights to Marquese Chriss","Kings","trade with Suns","On 2016-06-23, Kings makes trade with Suns for rights to Bogdan Bogdanovic in exhchange of rights to Marquese Chriss"
"2016-06-23","rights to Georgios Papagiannis / Giorgios Papagiannis / George Papagiannis","rights to Marquese Chriss","Kings","trade with Suns","On 2016-06-23, Kings makes trade with Suns for rights to Georgios Papagiannis / Giorgios Papagiannis / George Papagiannis in exhchange of rights to Marquese Chriss"
"2016-06-23","rights to Skal Labissiere","rights to Marquese Chriss","Kings","trade with Suns","On 2016-06-23, Kings makes trade with Suns for rights to Skal Labissiere in exhchange of rights to Marquese Chriss"
"2016-06-23","Serge Ibaka","Victor Oladipo","Magic","trade with Thunder","On 2016-06-23, Magic makes trade with Thunder for Serge Ibaka in exhchange of Victor Oladipo"
"2016-06-23","Serge Ibaka","Ersan Ilyasova","Magic","trade with Thunder","On 2016-06-23, Magic makes trade with Thunder for Serge Ibaka in exhchange of Ersan Ilyasova"
"2016-06-23","Serge Ibaka","rights to Domantas Sabonis / Domas Sabonis","Magic","trade with Thunder","On 2016-06-23, Magic makes trade with Thunder for Serge Ibaka in exhchange of rights to Domantas Sabonis / Domas Sabonis"
"2016-06-23","cash considerations","rights to Daniel Hamilton","Nuggets","trade with Thunder","On 2016-06-23, Nuggets makes trade with Thunder for cash considerations in exhchange of rights to Daniel Hamilton"
"2016-06-24","rights to Kahlil Felder / Kay Felder","cash considerations","Cavaliers","trade with Hawks","On 2016-06-24, Cavaliers makes trade with Hawks for rights to Kahlil Felder / Kay Felder in exhchange of cash considerations"
"2016-07-07","Shabazz Napier","cash considerations","Blazers","trade with Magic","On 2016-07-07, Blazers makes trade with Magic for Shabazz Napier in exhchange of cash considerations"
"2016-07-07","rights to Ater Majok","Jose Calderon","Bulls","trade with Lakers","On 2016-07-07, Bulls makes trade with Lakers for rights to Ater Majok in exhchange of Jose Calderon"
"2016-07-07","rights to Ater Majok","2018 second round pick (#47-Sviatoslav Mykhailiuk / Svi Mykhailiuk)","Bulls","trade with Lakers","On 2016-07-07, Bulls makes trade with Lakers for rights to Ater Majok in exhchange of 2018 second round pick (#47-Sviatoslav Mykhailiuk / Svi Mykhailiuk)"
"2016-07-07","rights to Taurean Prince","Jeff Teague","Hawks","3-team trade with Jazz, Pacers","On 2016-07-07, Hawks makes 3-team trade with Jazz, Pacers for rights to Taurean Prince in exhchange of Jeff Teague"
"2016-07-07","traded player exception","Jeff Teague","Hawks","3-team trade with Jazz, Pacers","On 2016-07-07, Hawks makes 3-team trade with Jazz, Pacers for traded player exception in exhchange of Jeff Teague"
"2016-07-07","Marco Belinelli","rights to Malachi Richardson","Hornets","trade with Kings","On 2016-07-07, Hornets makes trade with Kings for Marco Belinelli in exhchange of rights to Malachi Richardson"
"2016-07-07","Boris Diaw","rights to Olivier Hanlan","Jazz","trade with Spurs","On 2016-07-07, Jazz makes trade with Spurs for Boris Diaw in exhchange of rights to Olivier Hanlan"
"2016-07-07","Boris Diaw","traded player exception","Jazz","trade with Spurs","On 2016-07-07, Jazz makes trade with Spurs for Boris Diaw in exhchange of traded player exception"
"2016-07-07","cash","rights to Olivier Hanlan","Jazz","trade with Spurs","On 2016-07-07, Jazz makes trade with Spurs for cash in exhchange of rights to Olivier Hanlan"
"2016-07-07","cash","traded player exception","Jazz","trade with Spurs","On 2016-07-07, Jazz makes trade with Spurs for cash in exhchange of traded player exception"
"2016-07-07","George Hill","rights to Taurean Prince","Jazz","3-team trade with Hawks, Pacers","On 2016-07-07, Jazz makes 3-team trade with Hawks, Pacers for George Hill in exhchange of rights to Taurean Prince"
"2016-07-07","Andrew Bogut","traded player exception","Mavericks","trade with Warriors","On 2016-07-07, Mavericks makes trade with Warriors for Andrew Bogut in exhchange of traded player exception"
"2016-07-07","rights to Stanko Barac","Jeremy Evans","Mavericks","trade with Pacers","On 2016-07-07, Mavericks makes trade with Pacers for rights to Stanko Barac in exhchange of Jeremy Evans"
