"date","from","to","action_team","notes","edge_label"
"2017-06-22","rights to Lauri Markkanen","rights to Justin Patton","Bulls","trade with Timberwolves","On 2017-06-22, Bulls makes trade with Timberwolves for rights to Lauri Markkanen in exhchange of rights to Justin Patton"
"2017-06-22","rights to Dillon Brooks","2018 second round pick (least favorable of Grizzlies, Heat, Hornets picks) (#46-De'Anthony Melton)","Grizzlies","trade with Rockets","On 2017-06-22, Grizzlies makes trade with Rockets for rights to Dillon Brooks in exhchange of 2018 second round pick (least favorable of Grizzlies, Heat, Hornets picks) (#46-De'Anthony Melton)"
"2017-06-22","rights to Dwayne Bacon","rights to Frank Jackson","Hornets","trade with Pelicans","On 2017-06-22, Hornets makes trade with Pelicans for rights to Dwayne Bacon in exhchange of rights to Frank Jackson"
"2017-06-22","$1.8M cash","rights to Frank Jackson","Hornets","trade with Pelicans","On 2017-06-22, Hornets makes trade with Pelicans for $1.8M cash in exhchange of rights to Frank Jackson"
"2017-06-22","rights to Donovan Mitchell","Trey Lyles","Jazz","trade with Nuggets","On 2017-06-22, Jazz makes trade with Nuggets for rights to Donovan Mitchell in exhchange of Trey Lyles"
"2017-06-22","rights to Donovan Mitchell","rights to Tyler Lydon","Jazz","trade with Nuggets","On 2017-06-22, Jazz makes trade with Nuggets for rights to Donovan Mitchell in exhchange of rights to Tyler Lydon"
"2017-06-22","rights to Tony Bradley","rights to Josh Hart","Jazz","trade with Lakers","On 2017-06-22, Jazz makes trade with Lakers for rights to Tony Bradley in exhchange of rights to Josh Hart"
"2017-06-22","rights to Tony Bradley","rights to Thomas Bryant","Jazz","trade with Lakers","On 2017-06-22, Jazz makes trade with Lakers for rights to Tony Bradley in exhchange of rights to Thomas Bryant"
"2017-06-22","Brook Lopez","D'Angelo Russell","Lakers","trade with Nets","On 2017-06-22, Lakers makes trade with Nets for Brook Lopez in exhchange of D'Angelo Russell"
"2017-06-22","Brook Lopez","Timofey Mozgov","Lakers","trade with Nets","On 2017-06-22, Lakers makes trade with Nets for Brook Lopez in exhchange of Timofey Mozgov"
"2017-06-22","rights to Kyle Kuzma","D'Angelo Russell","Lakers","trade with Nets","On 2017-06-22, Lakers makes trade with Nets for rights to Kyle Kuzma in exhchange of D'Angelo Russell"
"2017-06-22","rights to Kyle Kuzma","Timofey Mozgov","Lakers","trade with Nets","On 2017-06-22, Lakers makes trade with Nets for rights to Kyle Kuzma in exhchange of Timofey Mozgov"
"2017-06-22","rights to Edmond Sumner","$1M cash","Pacers","trade with Pelicans","On 2017-06-22, Pacers makes trade with Pelicans for rights to Edmond Sumner in exhchange of $1M cash"
"2017-06-28","2018 second round pick (#60-Kostas Antetokounmpo)","Shawn Long","76ers","trade with Rockets","On 2017-06-28, 76ers makes trade with Rockets for 2018 second round pick (#60-Kostas Antetokounmpo) in exhchange of Shawn Long"
"2017-06-28","cash considerations","Shawn Long","76ers","trade with Rockets","On 2017-06-28, 76ers makes trade with Rockets for cash considerations in exhchange of Shawn Long"
"2017-06-28","cash considerations","Tim Quarterman","Blazers","trade with Rockets","On 2017-06-28, Blazers makes trade with Rockets for cash considerations in exhchange of Tim Quarterman"
"2017-06-28","cash considerations","Ryan Kelly","Hawks","trade with Rockets","On 2017-06-28, Hawks makes trade with Rockets for cash considerations in exhchange of Ryan Kelly"
"2017-06-28","cash considerations","DeAndre Liggins","Mavericks","trade with Rockets","On 2017-06-28, Mavericks makes trade with Rockets for cash considerations in exhchange of DeAndre Liggins"
"2017-06-28","cash considerations","Darrun Hilliard","Pistons","trade with Rockets","On 2017-06-28, Pistons makes trade with Rockets for cash considerations in exhchange of Darrun Hilliard"
"2017-06-28","Patrick Beverley","Chris Paul","Clippers","trade with Rockets","On 2017-06-28, Clippers makes trade with Rockets for Patrick Beverley in exhchange of Chris Paul"
"2017-06-28","Sam Dekker","Chris Paul","Clippers","trade with Rockets","On 2017-06-28, Clippers makes trade with Rockets for Sam Dekker in exhchange of Chris Paul"
"2017-06-28","Montrezl Harrell","Chris Paul","Clippers","trade with Rockets","On 2017-06-28, Clippers makes trade with Rockets for Montrezl Harrell in exhchange of Chris Paul"
"2017-06-28","Darrun Hilliard","Chris Paul","Clippers","trade with Rockets","On 2017-06-28, Clippers makes trade with Rockets for Darrun Hilliard in exhchange of Chris Paul"
"2017-06-28","DeAndre Liggins","Chris Paul","Clippers","trade with Rockets","On 2017-06-28, Clippers makes trade with Rockets for DeAndre Liggins in exhchange of Chris Paul"
"2017-06-28","Louis Williams / Lou Williams","Chris Paul","Clippers","trade with Rockets","On 2017-06-28, Clippers makes trade with Rockets for Louis Williams / Lou Williams in exhchange of Chris Paul"
"2017-06-28","Kyle Wiltjer","Chris Paul","Clippers","trade with Rockets","On 2017-06-28, Clippers makes trade with Rockets for Kyle Wiltjer in exhchange of Chris Paul"
"2017-06-28","first round pick (protected top 3 in 2018-23, unprotected in 2024) (2018 #30-Omari Spellman)","Chris Paul","Clippers","trade with Rockets","On 2017-06-28, Clippers makes trade with Rockets for first round pick (protected top 3 in 2018-23, unprotected in 2024) (2018 #30-Omari Spellman) in exhchange of Chris Paul"
"2017-06-28","$661K cash","Chris Paul","Clippers","trade with Rockets","On 2017-06-28, Clippers makes trade with Rockets for $661K cash in exhchange of Chris Paul"
"2017-06-29","cash","Jarrod Uthoff","Mavericks","trade with Rockets","On 2017-06-29, Mavericks makes trade with Rockets for cash in exhchange of Jarrod Uthoff"
"2017-06-30","Ricky Rubio","draft pick(s) (first round pick protected top 14 in 2018-20, else 2020 second round pick and 2021 second round pick) (2018 #20-Josh Okogie)","Jazz","trade with Timberwolves","On 2017-06-30, Jazz makes trade with Timberwolves for Ricky Rubio in exhchange of draft pick(s) (first round pick protected top 14 in 2018-20, else 2020 second round pick and 2021 second round pick) (2018 #20-Josh Okogie)"
"2017-07-06","cash considerations","rights to Sterling Brown","76ers","trade with Bucks","On 2017-07-06, 76ers makes trade with Bucks for cash considerations in exhchange of rights to Sterling Brown"
"2017-07-06","Victor Oladipo","Paul George","Pacers","trade with Thunder","On 2017-07-06, Pacers makes trade with Thunder for Victor Oladipo in exhchange of Paul George"
"2017-07-06","Domantas Sabonis / Domas Sabonis","Paul George","Pacers","trade with Thunder","On 2017-07-06, Pacers makes trade with Thunder for Domantas Sabonis / Domas Sabonis in exhchange of Paul George"
"2017-07-06","Danilo Gallinari","Jamal Crawford","Clippers","3-team trade with Hawks, Nuggets","On 2017-07-06, Clippers makes 3-team trade with Hawks, Nuggets for Danilo Gallinari in exhchange of Jamal Crawford"
"2017-07-06","Danilo Gallinari","Diamond Stone","Clippers","3-team trade with Hawks, Nuggets","On 2017-07-06, Clippers makes 3-team trade with Hawks, Nuggets for Danilo Gallinari in exhchange of Diamond Stone"
"2017-07-06","Danilo Gallinari","first round pick (protected top 3 in 2018-23, unprotected in 2024) (2018 #30-Omari Spellman)","Clippers","3-team trade with Hawks, Nuggets","On 2017-07-06, Clippers makes 3-team trade with Hawks, Nuggets for Danilo Gallinari in exhchange of first round pick (protected top 3 in 2018-23, unprotected in 2024) (2018 #30-Omari Spellman)"
"2017-07-06","Danilo Gallinari","cash","Clippers","3-team trade with Hawks, Nuggets","On 2017-07-06, Clippers makes 3-team trade with Hawks, Nuggets for Danilo Gallinari in exhchange of cash"
"2017-07-06","cash","rights to Jawun Evans","76ers","trade with Clippers","On 2017-07-06, 76ers makes trade with Clippers for cash in exhchange of rights to Jawun Evans"
"2017-07-07","Marcus Morris","Avery Bradley","Celtics","trade with Pistons","On 2017-07-07, Celtics makes trade with Pistons for Marcus Morris in exhchange of Avery Bradley"
"2017-07-07","A.J. Hammons","Josh McRoberts","Heat","trade with Mavericks","On 2017-07-07, Heat makes trade with Mavericks for A.J. Hammons in exhchange of Josh McRoberts"
"2017-07-07","A.J. Hammons","$5.1M cash","Heat","trade with Mavericks","On 2017-07-07, Heat makes trade with Mavericks for A.J. Hammons in exhchange of $5.1M cash"
"2017-07-13","DeMarre Carroll","Justin Hamilton (b)","Nets","trade with Raptors","On 2017-07-13, Nets makes trade with Raptors for DeMarre Carroll in exhchange of Justin Hamilton (b)"
"2017-07-13","draft pick(s) (first round pick protected top 14 in 2018-23, else 2023 second round pick and 2024 second round pick) (2018 #29-Dzanan Musa)","Justin Hamilton (b)","Nets","trade with Raptors","On 2017-07-13, Nets makes trade with Raptors for draft pick(s) (first round pick protected top 14 in 2018-23, else 2023 second round pick and 2024 second round pick) (2018 #29-Dzanan Musa) in exhchange of Justin Hamilton (b)"
"2017-07-13","2018 second round pick (less favorable of Lakers, Magic picks) (#40-Rodions Kurucs)","Justin Hamilton (b)","Nets","trade with Raptors","On 2017-07-13, Nets makes trade with Raptors for 2018 second round pick (less favorable of Lakers, Magic picks) (#40-Rodions Kurucs) in exhchange of Justin Hamilton (b)"
"2017-07-14","Cory Joseph","rights to Emir Preldzic","Pacers","trade with Raptors","On 2017-07-14, Pacers makes trade with Raptors for Cory Joseph in exhchange of rights to Emir Preldzic"
"2017-07-25","Andrew Nicholson","Allen Crabbe","Blazers","trade with Nets","On 2017-07-25, Blazers makes trade with Nets for Andrew Nicholson in exhchange of Allen Crabbe"
"2017-08-22","Isaiah Thomas","Kyrie Irving","Cavaliers","trade with Celtics","On 2017-08-22, Cavaliers makes trade with Celtics for Isaiah Thomas in exhchange of Kyrie Irving"
"2017-08-22","Jae Crowder","Kyrie Irving","Cavaliers","trade with Celtics","On 2017-08-22, Cavaliers makes trade with Celtics for Jae Crowder in exhchange of Kyrie Irving"
"2017-08-22","Ante Zizic","Kyrie Irving","Cavaliers","trade with Celtics","On 2017-08-22, Cavaliers makes trade with Celtics for Ante Zizic in exhchange of Kyrie Irving"
"2017-08-22","2018 first round pick (#8-Collin Sexton)","Kyrie Irving","Cavaliers","trade with Celtics","On 2017-08-22, Cavaliers makes trade with Celtics for 2018 first round pick (#8-Collin Sexton) in exhchange of Kyrie Irving"
"2017-09-01","Quincy Pondexter","rights to Ater Majok","Bulls","trade with Pelicans","On 2017-09-01, Bulls makes trade with Pelicans for Quincy Pondexter in exhchange of rights to Ater Majok"
"2017-09-01","2018 second round pick (#51-Tony Carr)","rights to Ater Majok","Bulls","trade with Pelicans","On 2017-09-01, Bulls makes trade with Pelicans for 2018 second round pick (#51-Tony Carr) in exhchange of rights to Ater Majok"
"2017-09-01","cash","rights to Ater Majok","Bulls","trade with Pelicans","On 2017-09-01, Bulls makes trade with Pelicans for cash in exhchange of rights to Ater Majok"
"2017-09-22","2018 second round pick (protected top 55) (not exercised)","Troy Daniels","Grizzlies","trade with Suns","On 2017-09-22, Grizzlies makes trade with Suns for 2018 second round pick (protected top 55) (not exercised) in exhchange of Troy Daniels"
"2017-09-22","2018 second round pick (protected top 55) (not exercised)","2018 second round pick (second least favorable of Grizzlies, Heat, Hornets picks) (#41-Jarred Vanderbilt)","Grizzlies","trade with Suns","On 2017-09-22, Grizzlies makes trade with Suns for 2018 second round pick (protected top 55) (not exercised) in exhchange of 2018 second round pick (second least favorable of Grizzlies, Heat, Hornets picks) (#41-Jarred Vanderbilt)"
"2017-09-25","Doug McDermott","Carmelo Anthony","Knicks","trade with Thunder","On 2017-09-25, Knicks makes trade with Thunder for Doug McDermott in exhchange of Carmelo Anthony"
"2017-09-25","Enes Kanter","Carmelo Anthony","Knicks","trade with Thunder","On 2017-09-25, Knicks makes trade with Thunder for Enes Kanter in exhchange of Carmelo Anthony"
"2017-09-25","2018 second round pick (#36-Mitchell Robinson)","Carmelo Anthony","Knicks","trade with Thunder","On 2017-09-25, Knicks makes trade with Thunder for 2018 second round pick (#36-Mitchell Robinson) in exhchange of Carmelo Anthony"
"2017-09-25","2018 second round pick (protected top 55) (not exercised)","DeAndre Liggins","Clippers","trade with Hawks","On 2017-09-25, Clippers makes trade with Hawks for 2018 second round pick (protected top 55) (not exercised) in exhchange of DeAndre Liggins"
"2017-09-25","2018 second round pick (protected top 55) (not exercised)","cash","Clippers","trade with Hawks","On 2017-09-25, Clippers makes trade with Hawks for 2018 second round pick (protected top 55) (not exercised) in exhchange of cash"
"2017-10-14","rights to Sergiy Gladyr / Sergey Gladyr","Richard Jefferson","Cavaliers","trade with Hawks","On 2017-10-14, Cavaliers makes trade with Hawks for rights to Sergiy Gladyr / Sergey Gladyr in exhchange of Richard Jefferson"
"2017-10-14","rights to Sergiy Gladyr / Sergey Gladyr","Kahlil Felder / Kay Felder","Cavaliers","trade with Hawks","On 2017-10-14, Cavaliers makes trade with Hawks for rights to Sergiy Gladyr / Sergey Gladyr in exhchange of Kahlil Felder / Kay Felder"
"2017-10-14","rights to Sergiy Gladyr / Sergey Gladyr","$3M cash","Cavaliers","trade with Hawks","On 2017-10-14, Cavaliers makes trade with Hawks for rights to Sergiy Gladyr / Sergey Gladyr in exhchange of $3M cash"
"2017-10-14","rights to Dimitrios Agravanis","Richard Jefferson","Cavaliers","trade with Hawks","On 2017-10-14, Cavaliers makes trade with Hawks for rights to Dimitrios Agravanis in exhchange of Richard Jefferson"
"2017-10-14","rights to Dimitrios Agravanis","Kahlil Felder / Kay Felder","Cavaliers","trade with Hawks","On 2017-10-14, Cavaliers makes trade with Hawks for rights to Dimitrios Agravanis in exhchange of Kahlil Felder / Kay Felder"
"2017-10-14","rights to Dimitrios Agravanis","$3M cash","Cavaliers","trade with Hawks","On 2017-10-14, Cavaliers makes trade with Hawks for rights to Dimitrios Agravanis in exhchange of $3M cash"
"2017-11-07","Eric Bledsoe","Greg Monroe","Bucks","trade with Suns","On 2017-11-07, Bucks makes trade with Suns for Eric Bledsoe in exhchange of Greg Monroe"
"2017-11-07","Eric Bledsoe","2018 second round pick (protected top 47) (not exercised)","Bucks","trade with Suns","On 2017-11-07, Bucks makes trade with Suns for Eric Bledsoe in exhchange of 2018 second round pick (protected top 47) (not exercised)"
"2017-12-07","Trevor Booker","Jahlil Okafor","76ers","trade with Nets","On 2017-12-07, 76ers makes trade with Nets for Trevor Booker in exhchange of Jahlil Okafor"
"2017-12-07","Trevor Booker","Nik Stauskas","76ers","trade with Nets","On 2017-12-07, 76ers makes trade with Nets for Trevor Booker in exhchange of Nik Stauskas"
"2018-01-29","Tobias Harris","Blake Griffin","Clippers","trade with Pistons","On 2018-01-29, Clippers makes trade with Pistons for Tobias Harris in exhchange of Blake Griffin"
"2018-01-29","Tobias Harris","Brice Johnson","Clippers","trade with Pistons","On 2018-01-29, Clippers makes trade with Pistons for Tobias Harris in exhchange of Brice Johnson"
"2018-01-29","Tobias Harris","Willie Reed","Clippers","trade with Pistons","On 2018-01-29, Clippers makes trade with Pistons for Tobias Harris in exhchange of Willie Reed"
"2018-01-29","Avery Bradley","Blake Griffin","Clippers","trade with Pistons","On 2018-01-29, Clippers makes trade with Pistons for Avery Bradley in exhchange of Blake Griffin"
"2018-01-29","Avery Bradley","Brice Johnson","Clippers","trade with Pistons","On 2018-01-29, Clippers makes trade with Pistons for Avery Bradley in exhchange of Brice Johnson"
"2018-01-29","Avery Bradley","Willie Reed","Clippers","trade with Pistons","On 2018-01-29, Clippers makes trade with Pistons for Avery Bradley in exhchange of Willie Reed"
"2018-01-29","Boban Marjanovic","Blake Griffin","Clippers","trade with Pistons","On 2018-01-29, Clippers makes trade with Pistons for Boban Marjanovic in exhchange of Blake Griffin"
"2018-01-29","Boban Marjanovic","Brice Johnson","Clippers","trade with Pistons","On 2018-01-29, Clippers makes trade with Pistons for Boban Marjanovic in exhchange of Brice Johnson"
"2018-01-29","Boban Marjanovic","Willie Reed","Clippers","trade with Pistons","On 2018-01-29, Clippers makes trade with Pistons for Boban Marjanovic in exhchange of Willie Reed"
"2018-01-29","first round pick (protected top 4 in 2018-20, unprotected in 2021) (2018 #12-Miles Bridges)","Blake Griffin","Clippers","trade with Pistons","On 2018-01-29, Clippers makes trade with Pistons for first round pick (protected top 4 in 2018-20, unprotected in 2021) (2018 #12-Miles Bridges) in exhchange of Blake Griffin"
"2018-01-29","first round pick (protected top 4 in 2018-20, unprotected in 2021) (2018 #12-Miles Bridges)","Brice Johnson","Clippers","trade with Pistons","On 2018-01-29, Clippers makes trade with Pistons for first round pick (protected top 4 in 2018-20, unprotected in 2021) (2018 #12-Miles Bridges) in exhchange of Brice Johnson"
"2018-01-29","first round pick (protected top 4 in 2018-20, unprotected in 2021) (2018 #12-Miles Bridges)","Willie Reed","Clippers","trade with Pistons","On 2018-01-29, Clippers makes trade with Pistons for first round pick (protected top 4 in 2018-20, unprotected in 2021) (2018 #12-Miles Bridges) in exhchange of Willie Reed"
"2018-02-01","Omer Asik","Nikola Mirotic","Bulls","trade with Pelicans","On 2018-02-01, Bulls makes trade with Pelicans for Omer Asik in exhchange of Nikola Mirotic"
"2018-02-01","Omer Asik","2018 second round pick (#51-Tony Carr)","Bulls","trade with Pelicans","On 2018-02-01, Bulls makes trade with Pelicans for Omer Asik in exhchange of 2018 second round pick (#51-Tony Carr)"
"2018-02-01","Tony Allen","Nikola Mirotic","Bulls","trade with Pelicans","On 2018-02-01, Bulls makes trade with Pelicans for Tony Allen in exhchange of Nikola Mirotic"
"2018-02-01","Tony Allen","2018 second round pick (#51-Tony Carr)","Bulls","trade with Pelicans","On 2018-02-01, Bulls makes trade with Pelicans for Tony Allen in exhchange of 2018 second round pick (#51-Tony Carr)"
"2018-02-01","Jameer Nelson","Nikola Mirotic","Bulls","trade with Pelicans","On 2018-02-01, Bulls makes trade with Pelicans for Jameer Nelson in exhchange of Nikola Mirotic"
"2018-02-01","Jameer Nelson","2018 second round pick (#51-Tony Carr)","Bulls","trade with Pelicans","On 2018-02-01, Bulls makes trade with Pelicans for Jameer Nelson in exhchange of 2018 second round pick (#51-Tony Carr)"
"2018-02-01","first round pick (protected top 5 in 2018, top 8 in 2019, top 10 in 2020, top 9 in 2021, top 6 in 2022, else 2022 second round pick, 2023 second round pick) (2018 #22-Chandler Hutchison)","Nikola Mirotic","Bulls","trade with Pelicans","On 2018-02-01, Bulls makes trade with Pelicans for first round pick (protected top 5 in 2018, top 8 in 2019, top 10 in 2020, top 9 in 2021, top 6 in 2022, else 2022 second round pick, 2023 second round pick) (2018 #22-Chandler Hutchison) in exhchange of Nikola Mirotic"
"2018-02-01","first round pick (protected top 5 in 2018, top 8 in 2019, top 10 in 2020, top 9 in 2021, top 6 in 2022, else 2022 second round pick, 2023 second round pick) (2018 #22-Chandler Hutchison)","2018 second round pick (#51-Tony Carr)","Bulls","trade with Pelicans","On 2018-02-01, Bulls makes trade with Pelicans for first round pick (protected top 5 in 2018, top 8 in 2019, top 10 in 2020, top 9 in 2021, top 6 in 2022, else 2022 second round pick, 2023 second round pick) (2018 #22-Chandler Hutchison) in exhchange of 2018 second round pick (#51-Tony Carr)"
"2018-02-05","Tyler Zeller","Rashad Vaughn","Bucks","trade with Nets","On 2018-02-05, Bucks makes trade with Nets for Tyler Zeller in exhchange of Rashad Vaughn"
"2018-02-05","Tyler Zeller","second round pick (protected #48-60 in 2018, else unprotected in 2020) (2018 #45-Hamidou Diallo)","Bucks","trade with Nets","On 2018-02-05, Bucks makes trade with Nets for Tyler Zeller in exhchange of second round pick (protected #48-60 in 2018, else unprotected in 2020) (2018 #45-Hamidou Diallo)"
"2018-02-07","Guillermo Hernangomez / Willy Hernangomez","Johnny O'Bryant III","Hornets","trade with Knicks","On 2018-02-07, Hornets makes trade with Knicks for Guillermo Hernangomez / Willy Hernangomez in exhchange of Johnny O'Bryant III"
"2018-02-08","rights to Milovan Rakovic","Noah Vonleh","Blazers","trade with Bulls","On 2018-02-08, Blazers makes trade with Bulls for rights to Milovan Rakovic in exhchange of Noah Vonleh"
"2018-02-08","rights to Milovan Rakovic","cash","Blazers","trade with Bulls","On 2018-02-08, Blazers makes trade with Bulls for rights to Milovan Rakovic in exhchange of cash"
"2018-02-08","Jordan Clarkson","Isaiah Thomas","Cavaliers","trade with Lakers","On 2018-02-08, Cavaliers makes trade with Lakers for Jordan Clarkson in exhchange of Isaiah Thomas"
"2018-02-08","Jordan Clarkson","Channing Frye","Cavaliers","trade with Lakers","On 2018-02-08, Cavaliers makes trade with Lakers for Jordan Clarkson in exhchange of Channing Frye"
"2018-02-08","Jordan Clarkson","draft pick (protected top 3 in 2018, top 10 in 2023, else 2023 second round pick) (2018 #25-Moritz Wagner / Moe Wagner)","Cavaliers","trade with Lakers","On 2018-02-08, Cavaliers makes trade with Lakers for Jordan Clarkson in exhchange of draft pick (protected top 3 in 2018, top 10 in 2023, else 2023 second round pick) (2018 #25-Moritz Wagner / Moe Wagner)"
"2018-02-08","Larry Nance Jr.","Isaiah Thomas","Cavaliers","trade with Lakers","On 2018-02-08, Cavaliers makes trade with Lakers for Larry Nance Jr. in exhchange of Isaiah Thomas"
"2018-02-08","Larry Nance Jr.","Channing Frye","Cavaliers","trade with Lakers","On 2018-02-08, Cavaliers makes trade with Lakers for Larry Nance Jr. in exhchange of Channing Frye"
"2018-02-08","Larry Nance Jr.","draft pick (protected top 3 in 2018, top 10 in 2023, else 2023 second round pick) (2018 #25-Moritz Wagner / Moe Wagner)","Cavaliers","trade with Lakers","On 2018-02-08, Cavaliers makes trade with Lakers for Larry Nance Jr. in exhchange of draft pick (protected top 3 in 2018, top 10 in 2023, else 2023 second round pick) (2018 #25-Moritz Wagner / Moe Wagner)"
"2018-02-08","2018 second round pick (second least favorable of Grizzlies, Heat, Hornets picks) (#41-Jarred Vanderbilt)","Elfrid Payton","Magic","trade with Suns","On 2018-02-08, Magic makes trade with Suns for 2018 second round pick (second least favorable of Grizzlies, Heat, Hornets picks) (#41-Jarred Vanderbilt) in exhchange of Elfrid Payton"
"2018-02-08","Dante Cunningham","Rashad Vaughn","Nets","trade with Pelicans","On 2018-02-08, Nets makes trade with Pelicans for Dante Cunningham in exhchange of Rashad Vaughn"
"2018-02-08","Willie Reed","Jameer Nelson","Bulls","trade with Pistons","On 2018-02-08, Bulls makes trade with Pistons for Willie Reed in exhchange of Jameer Nelson"
"2018-02-08","George Hill","Derrick Rose","Cavaliers","3-team trade with Jazz, Kings","On 2018-02-08, Cavaliers makes 3-team trade with Jazz, Kings for George Hill in exhchange of Derrick Rose"
"2018-02-08","George Hill","Jae Crowder","Cavaliers","3-team trade with Jazz, Kings","On 2018-02-08, Cavaliers makes 3-team trade with Jazz, Kings for George Hill in exhchange of Jae Crowder"
"2018-02-08","George Hill","Iman Shumpert","Cavaliers","3-team trade with Jazz, Kings","On 2018-02-08, Cavaliers makes 3-team trade with Jazz, Kings for George Hill in exhchange of Iman Shumpert"
"2018-02-08","George Hill","rights to Dimitrios Agravanis","Cavaliers","3-team trade with Jazz, Kings","On 2018-02-08, Cavaliers makes 3-team trade with Jazz, Kings for George Hill in exhchange of rights to Dimitrios Agravanis"
"2018-02-08","George Hill","$2.1M cash","Cavaliers","3-team trade with Jazz, Kings","On 2018-02-08, Cavaliers makes 3-team trade with Jazz, Kings for George Hill in exhchange of $2.1M cash"
"2018-02-08","Rodney Hood","Derrick Rose","Cavaliers","3-team trade with Jazz, Kings","On 2018-02-08, Cavaliers makes 3-team trade with Jazz, Kings for Rodney Hood in exhchange of Derrick Rose"
"2018-02-08","Rodney Hood","Jae Crowder","Cavaliers","3-team trade with Jazz, Kings","On 2018-02-08, Cavaliers makes 3-team trade with Jazz, Kings for Rodney Hood in exhchange of Jae Crowder"
"2018-02-08","Rodney Hood","Iman Shumpert","Cavaliers","3-team trade with Jazz, Kings","On 2018-02-08, Cavaliers makes 3-team trade with Jazz, Kings for Rodney Hood in exhchange of Iman Shumpert"
"2018-02-08","Rodney Hood","rights to Dimitrios Agravanis","Cavaliers","3-team trade with Jazz, Kings","On 2018-02-08, Cavaliers makes 3-team trade with Jazz, Kings for Rodney Hood in exhchange of rights to Dimitrios Agravanis"
"2018-02-08","Rodney Hood","$2.1M cash","Cavaliers","3-team trade with Jazz, Kings","On 2018-02-08, Cavaliers makes 3-team trade with Jazz, Kings for Rodney Hood in exhchange of $2.1M cash"
"2018-02-08","rights to Arturas Gudaitis","Derrick Rose","Cavaliers","3-team trade with Jazz, Kings","On 2018-02-08, Cavaliers makes 3-team trade with Jazz, Kings for rights to Arturas Gudaitis in exhchange of Derrick Rose"
"2018-02-08","rights to Arturas Gudaitis","Jae Crowder","Cavaliers","3-team trade with Jazz, Kings","On 2018-02-08, Cavaliers makes 3-team trade with Jazz, Kings for rights to Arturas Gudaitis in exhchange of Jae Crowder"
"2018-02-08","rights to Arturas Gudaitis","Iman Shumpert","Cavaliers","3-team trade with Jazz, Kings","On 2018-02-08, Cavaliers makes 3-team trade with Jazz, Kings for rights to Arturas Gudaitis in exhchange of Iman Shumpert"
